{
  "$schema": "./schema/spec.schema.json",
  "spec": "MemorySmith Markdown Specification",
  "variant": "MemorySmith",
  "url": "https://github.com/memorysmithapp/memorysmithapp-markdown/blob/v0.7.0/packages/markdown-spec/SPEC.md",
  "sources": [
    {
      "id": "commonmark",
      "name": "CommonMark",
      "version": "0.31.2",
      "url": "https://spec.commonmark.org/0.31.2/"
    },
    {
      "id": "gfm",
      "name": "GitHub Flavored Markdown",
      "version": "0.29-gfm",
      "url": "https://github.github.com/gfm/"
    },
    {
      "id": "obsidian",
      "name": "Obsidian",
      "url": "https://help.obsidian.md/syntax"
    }
  ],
  "notations": [
    {
      "id": "paragraph",
      "reader": "reading-surface",
      "syntax": "Lines of text, ended by a blank line",
      "example": "A paragraph.\n\nA second one.\n",
      "effect": "The default block: consecutive lines are one paragraph and a blank line ends it. It is also the unit a block identifier names, since a `^id` at the end of one names that block.",
      "spec": "3.1"
    },
    {
      "id": "backslash-escape",
      "reader": "reading-surface",
      "syntax": "\\ before an ASCII punctuation character",
      "example": "To name the forms without invoking them: \\[\\[wikilink\\]\\], \\=\\=marked\\=\\=, \\%\\%comment\\%\\%, \\$formula\\$.",
      "effect": "The character that follows is literal. It is how this specification's own notation is written as text — `\\[\\[`, `\\=\\=`, `\\%\\%`, `\\$` — and how a line is stopped from becoming a list, with the backslash before the period rather than before the number.",
      "spec": "3.2"
    },
    {
      "id": "character-reference",
      "reader": "reading-surface",
      "syntax": "&amp;  ·  &#35;  ·  &#X1F600;",
      "example": "The ampersand is written &amp; and the hash &#35;.",
      "effect": "Resolves to the character it names, anywhere a literal character is allowed. Only the HTML5 named references are valid; anything else stays as it was typed.",
      "spec": "3.2"
    },
    {
      "id": "heading-atx",
      "reader": "reading-surface",
      "syntax": "# Title  ·  ###### Title",
      "example": "## Direct contracting\n\nThe rule.\n",
      "effect": "A heading of levels one to six, and the structure of the body of a note: `#` is its first level. A heading is what a wikilink anchor points at: `[[Target#Direct contracting]]` names one, and the anchor is kept for display without changing which note is resolved. The name of the note is the `name:` of its frontmatter, which the page draws above the body.",
      "spec": "3.3"
    },
    {
      "id": "heading-setext",
      "reader": "reading-surface",
      "syntax": "Title, then a line of === or ---",
      "example": "Direct contracting\n==================\n\nThe rule.\n",
      "effect": "A heading of level one or two, equivalent to the ATX form at those levels. A `---` directly under a paragraph is this, and not a thematic break.",
      "spec": "3.3"
    },
    {
      "id": "thematic-break",
      "reader": "reading-surface",
      "syntax": "---  ·  ***  ·  ___",
      "example": "The general rule ends here.\n\n---\n\nThe exception begins.\n",
      "effect": "A horizontal division. `---` is context-dependent and all three readings are correct in their place: on the first line of the file it opens frontmatter, directly under a paragraph it is a setext heading, anywhere else it is a thematic break.",
      "spec": "3.4"
    },
    {
      "id": "block-quote",
      "reader": "reading-surface",
      "syntax": "> text",
      "example": "> The administration is bound by the notice.\n>\n> > And by the one that preceded it.\n",
      "effect": "A quotation, which may hold any block including another quotation. A block quote whose first line begins with `[!type]` is a callout instead, and that is the only thing that tells the two apart.",
      "spec": "3.5"
    },
    {
      "id": "list-bullet",
      "reader": "reading-surface",
      "syntax": "- item  ·  + item  ·  * item",
      "example": "- Preliminary study\n  1. Estimate the demand\n  2. Price the market\n- Draft the notice\n  - [ ] Attach the price research\n",
      "effect": "An unordered list. Changing the marker character starts a new list, and a blank line between items makes the list loose, which is what changes the spacing.",
      "spec": "3.6"
    },
    {
      "id": "list-ordered",
      "reader": "reading-surface",
      "syntax": "1. item  ·  1) item",
      "example": "1. Publish the notice\n1. Receive the proposals\n1. Judge and rank\n",
      "effect": "An ordered list. The number of the first item sets where it starts and the numbers of the rest are ignored, so a list written entirely with `1.` numbers itself correctly.",
      "spec": "3.6"
    },
    {
      "id": "code-fenced",
      "reader": "reading-surface",
      "syntax": "Three or more backticks or tildes, with an optional info string",
      "example": "````\nHere is how a diagram is written:\n\n```mermaid\ngraph TD\n  Notice --> Proposals\n```\n````\n",
      "effect": "A code block. Nothing inside is parsed: no emphasis, no links, no wikilinks, no callouts. A fence opens at the start of a line and closes only on a line holding the same character at the same length or longer and nothing else, or at the end of the document, so a fence nests — an outer fence uses more characters than any inside it, or a different character. `mermaid` is the one info string this specification attaches a rendering rule to.",
      "spec": "3.7"
    },
    {
      "id": "code-indented",
      "reader": "reading-surface",
      "syntax": "four spaces, or one tab",
      "example": "    an indented code block\n",
      "effect": "A code block written by indentation. It suppresses every notation inside it exactly as a fenced block does.",
      "spec": "3.7"
    },
    {
      "id": "link-reference-definition",
      "reader": "reading-surface",
      "syntax": "[label]: /url \"Optional title\"",
      "example": "[the act]: https://example.org/lei-14133\n\nSee [the act].\n",
      "effect": "Binds a label to a destination and renders nothing where it stands. A reference with no definition renders as literal text, brackets and all.",
      "spec": "3.8"
    },
    {
      "id": "code-span",
      "reader": "reading-surface",
      "syntax": "`code`  ·  ``a span holding a ` backtick``",
      "example": "The closing fence is ``a run of ` characters`` at least as long as the opening one.",
      "effect": "Inline code. A run of one or more backticks closes on a run of exactly the same length, so a span can hold a backtick by using two. One leading and one trailing space are stripped when both are present. It is where an author writes notation without invoking it, and an Indexer MUST NOT extract a link found inside one.",
      "spec": "3.11"
    },
    {
      "id": "emphasis",
      "reader": "reading-surface",
      "syntax": "*text*  ·  _text_",
      "example": "The rule is *usually* the exception, and **the notice binds _both_ sides**.",
      "effect": "Emphasis. It nests inside strong emphasis — `**a _b_ c**` — where the inner delimiter uses the other character, because a run of the same one would close the outer form instead of opening an inner one. `_` does not open or close inside a word, so `snake_case_name` is one word; `*` does, so `un*frigging*believable` works.",
      "spec": "3.12"
    },
    {
      "id": "strong",
      "reader": "reading-surface",
      "syntax": "**text**  ·  __text__",
      "example": "This is **not** optional.",
      "effect": "Strong emphasis. `==highlight==` is neither this nor CommonMark: it is marked text, and it belongs to the MemorySmith ring.",
      "spec": "3.12"
    },
    {
      "id": "strong-emphasis",
      "reader": "reading-surface",
      "syntax": "***text***  ·  ___text___",
      "example": "The deadline is ***not*** negotiable.",
      "effect": "Emphasis and strong emphasis at once. `___` alone on a line is a thematic break instead, because blocks are resolved before inlines.",
      "spec": "3.12"
    },
    {
      "id": "link-inline",
      "reader": "reading-surface",
      "syntax": "[text](destination \"optional title\")",
      "example": "See [the official text](https://example.org/lei-14133).",
      "effect": "A link. Whether it becomes an edge is decided by the destination alone: a relative target inside the notebook does, anything carrying a scheme or a host does not.",
      "spec": "3.13"
    },
    {
      "id": "link-reference",
      "reader": "reading-surface",
      "syntax": "[text][label]  ·  [label][]  ·  [label]",
      "example": "See [the act][] for the general rule.",
      "effect": "A link resolved against a reference definition. The three forms are equivalent once resolved, and the destination decides the edge exactly as in the inline form.",
      "spec": "3.13"
    },
    {
      "id": "image",
      "reader": "reading-surface",
      "syntax": "![alt text](image.png \"optional title\")",
      "example": "![The seal of the act](seal.png)",
      "effect": "An image. The alt text is the description and a Reader MUST NOT drop it — which is what a person gets when the image does not load. A `|` inside the alt text separates that description from the image's dimensions (see `image-dimensions`). Where a destination that names no host is found is §5.8; a destination naming a host makes the image a request to that host when the note is opened, and §7.10 governs what a Reader may do about that. A `!` in front of a wikilink is not this: `![[target]]` is an embed.",
      "spec": "3.14, 7.10"
    },
    {
      "id": "autolink",
      "reader": "reading-surface",
      "syntax": "<https://example.org/page>  ·  <someone@example.org>",
      "example": "The text is at <https://example.org/lei-14133>.",
      "effect": "A URI or an email address linked as itself. It is external, and therefore never an edge.",